{
  "concepts_triggered": [
    "agentic listening",
    "claim taxonomy",
    "auditum and acoulogical object",
    "transduction and media conversion",
    "critical-political and decolonial listening"
  ],
  "sonic_methodologies": [
    "mode selection before answer",
    "claim taxonomy audit",
    "auditum-first description",
    "source-domain to target-domain mapping",
    "mediation and infrastructure critique"
  ],
  "authors_or_traditions": [
    "Pierre Schaeffer / Michel Chion",
    "Jonathan Sterne",
    "digital sound studies",
    "critical sound studies",
    "decolonial listening"
  ],
  "possible_research_routes": [
    "sound as multidimensional event rather than single source",
    "describe sonic shape before source identity",
    "map what is transformed, lost, invented, and compressed",
    "name concrete mediations and asymmetries"
  ],
  "research_questions": [
    "Which claims are heard, measured, inferred, interpreted, speculative, or undetermined?",
    "What is the heard object before it becomes a source claim?",
    "What does the mediation chain hide, smooth, or invent?",
    "Who or what becomes inaudible in this frame?"
  ],
  "cautions": [
    "Do not use references as decoration when the input is thin.",
    "Do not let theory override claim discipline.",
    "Do not confuse source with auditum.",
    "Do not treat mediated sound as direct access to source.",
    "Critique must not become automatic accusation."
  ],
  "adjacent_modes": [
    "acoulogical-object-listening",
    "transductive-media-listening",
    "critical-political-listening"
  ]
}
